titulo,precio,numero_vendidos,envio_gratis
Combo Cama Doble + 2 Mesas De Noche Maderkit 01121-prm,369.900,190 vendidos,Entrega a acordar con el vendedor
Herraje Para Cama Baúl 900 Newton,,Nuevo  -  25 vendidos,Entrega a acordar con el vendedor
Herraje Para Cama Baúl 400 Newton,,Nuevo  -  43 vendidos,Entrega a acordar con el vendedor
Cama Doble O Semidoble En Mdf Y Rh Macizo +2 Mesas De Noche,,Nuevo  -  3 vendidos,Entrega a acordar con el vendedor
Cama Doble O Semidoble En Mdf Y Rh Macizo + Colchon,,Nuevo  -  2 vendidos,Entrega a acordar con el vendedor
"Cama Doble Colchon 2 Mesas De Noche,semanario,coqueto,butaco",,Nuevo  -  3 vendidos,Entrega a acordar con el vendedor
Cama Doble Moderna Madera Lacado Poliuretano Ref: Hera.,,Nuevo  -  4 vendidos,Entrega a acordar con el vendedor
Cama Doble En Mdf Y Rh Macizo + 2 Mesas De Noche,,Nuevo  -  7 vendidos,Entrega a acordar con el vendedor
Cama Queen Moderna En Madera Estilo Chino Ref: Hera.,,Nuevo  -  2 vendidos,Entrega a acordar con el vendedor
Step2 Hot Wheels Bed Cama Bebes Niños Con Luces Carro,,Nuevo  -  2 vendidos,Entrega a acordar con el vendedor
Cama Doble Moderna Flotante Cedro Cabecero Tapizado Centro,,Nuevo  -  2 vendidos,Entrega a acordar con el vendedor
Base Cama Doble 140*190 Promocion Envio Gratis Medellin,,Nuevo  -  19 vendidos,Entrega a acordar con el vendedor
Combo Base Cama + Cabecero Entero - 160 X 190 - Queen C,559.800,Nuevo  -  7 vendidos,Entrega a acordar con el vendedor
Base Cama Con Colchon Doble Semi Ortopedico 140*190,,Nuevo  -  17 vendidos,Entrega a acordar con el vendedor
Cama Nido Color Caramelo Maderkit M00738ca-prm,551.900,3 vendidos,Entrega a acordar con el vendedor
Cama Duo Con Auxiliar (medellin Y Cercanos)1.00x1.90,,Nuevo  -  71 vendidos,Entrega a acordar con el vendedor
Combo Queen Colchón 160x190 + Base Cama +envio Gratis Bogota,499.900,Nuevo  -  129 vendidos,Entrega a acordar con el vendedor
Cama Queen En Mdf Y Rh Macizo 160 X 190,,Nuevo  -  1 vendido,Entrega a acordar con el vendedor
"Delta Niños Niñas Dosel Para La Cama De Niño, Púrpura",,Nuevo  -  2 vendidos,Entrega a acordar con el vendedor
Cama King Moderna En Madera Estilo Chino Ref: Hera.,,Nuevo  -  1 vendido,Entrega a acordar con el vendedor
